{
  "formatVersion": "1.0.0",
  "scope": "comparison-profile",
  "profile": "OB-2020-12",
  "profileVersion": "0.1",
  "description": "Exact JSON-text cases for the same optional comparison profile. Expected outcomes are authored from profile rules; numberTokens protect fixture carriage, not production semantics.",
  "cases": [
    {
      "id": "wide-const",
      "rule": "exact const equality",
      "mode": "subsume",
      "direction": "input",
      "leftJSON": "{\"openbindings\":\"0.2.0\",\"operations\":{\"test\":{\"input\":{\"const\":9007199254740992}}}}",
      "rightJSON": "{\"openbindings\":\"0.2.0\",\"operations\":{\"test\":{\"input\":{\"const\":9007199254740993}}}}",
      "expected": {
        "verdict": "incompatible"
      },
      "witness": {
        "instanceJSON": "9007199254740992",
        "targetValid": true,
        "candidateValid": false
      },
      "numberTokens": {
        "left": [
          "9007199254740992"
        ],
        "right": [
          "9007199254740993"
        ],
        "witness": [
          "9007199254740992"
        ]
      }
    },
    {
      "id": "nested-wide-const",
      "rule": "recursive instance equality",
      "mode": "subsume",
      "direction": "input",
      "leftJSON": "{\"openbindings\":\"0.2.0\",\"operations\":{\"test\":{\"input\":{\"const\":{\"id\":9007199254740992}}}}}",
      "rightJSON": "{\"openbindings\":\"0.2.0\",\"operations\":{\"test\":{\"input\":{\"const\":{\"id\":9007199254740993}}}}}",
      "expected": {
        "verdict": "incompatible"
      },
      "witness": {
        "instanceJSON": "{\"id\":9007199254740992}",
        "targetValid": true,
        "candidateValid": false
      },
      "numberTokens": {
        "left": [
          "9007199254740992"
        ],
        "right": [
          "9007199254740993"
        ],
        "witness": [
          "9007199254740992"
        ]
      }
    },
    {
      "id": "wide-enum",
      "rule": "exact enum membership",
      "mode": "subsume",
      "direction": "input",
      "leftJSON": "{\"openbindings\":\"0.2.0\",\"operations\":{\"test\":{\"input\":{\"enum\":[9007199254740992]}}}}",
      "rightJSON": "{\"openbindings\":\"0.2.0\",\"operations\":{\"test\":{\"input\":{\"enum\":[9007199254740993]}}}}",
      "expected": {
        "verdict": "incompatible"
      },
      "witness": {
        "instanceJSON": "9007199254740992",
        "targetValid": true,
        "candidateValid": false
      },
      "numberTokens": {
        "left": [
          "9007199254740992"
        ],
        "right": [
          "9007199254740993"
        ],
        "witness": [
          "9007199254740992"
        ]
      }
    },
    {
      "id": "equivalent-decimal-spelling",
      "rule": "numeric spelling is not value identity",
      "mode": "subsume",
      "direction": "input",
      "leftJSON": "{\"openbindings\":\"0.2.0\",\"operations\":{\"test\":{\"input\":{\"const\":1}}}}",
      "rightJSON": "{\"openbindings\":\"0.2.0\",\"operations\":{\"test\":{\"input\":{\"const\":1.0}}}}",
      "expected": {
        "verdict": "compatible"
      },
      "witness": {
        "instanceJSON": "1",
        "targetValid": true,
        "candidateValid": true
      },
      "numberTokens": {
        "left": [
          "1"
        ],
        "right": [
          "1.0"
        ],
        "witness": [
          "1"
        ]
      }
    },
    {
      "id": "equivalent-exponent",
      "rule": "numeric spelling is not value identity",
      "mode": "subsume",
      "direction": "input",
      "leftJSON": "{\"openbindings\":\"0.2.0\",\"operations\":{\"test\":{\"input\":{\"const\":1}}}}",
      "rightJSON": "{\"openbindings\":\"0.2.0\",\"operations\":{\"test\":{\"input\":{\"const\":1e0}}}}",
      "expected": {
        "verdict": "compatible"
      },
      "witness": {
        "instanceJSON": "1",
        "targetValid": true,
        "candidateValid": true
      },
      "numberTokens": {
        "left": [
          "1"
        ],
        "right": [
          "1e0"
        ],
        "witness": [
          "1"
        ]
      }
    },
    {
      "id": "signed-zero",
      "rule": "zero has one mathematical value",
      "mode": "subsume",
      "direction": "input",
      "leftJSON": "{\"openbindings\":\"0.2.0\",\"operations\":{\"test\":{\"input\":{\"const\":-0}}}}",
      "rightJSON": "{\"openbindings\":\"0.2.0\",\"operations\":{\"test\":{\"input\":{\"const\":0}}}}",
      "expected": {
        "verdict": "compatible"
      },
      "witness": {
        "instanceJSON": "0",
        "targetValid": true,
        "candidateValid": true
      },
      "numberTokens": {
        "left": [
          "-0"
        ],
        "right": [
          "0"
        ],
        "witness": [
          "0"
        ]
      }
    },
    {
      "id": "ordinary-decimal",
      "rule": "decimal equality without binary expansion",
      "mode": "subsume",
      "direction": "input",
      "leftJSON": "{\"openbindings\":\"0.2.0\",\"operations\":{\"test\":{\"input\":{\"const\":0.1}}}}",
      "rightJSON": "{\"openbindings\":\"0.2.0\",\"operations\":{\"test\":{\"input\":{\"const\":0.10}}}}",
      "expected": {
        "verdict": "compatible"
      },
      "witness": {
        "instanceJSON": "0.1",
        "targetValid": true,
        "candidateValid": true
      },
      "numberTokens": {
        "left": [
          "0.1"
        ],
        "right": [
          "0.10"
        ],
        "witness": [
          "0.1"
        ]
      }
    },
    {
      "id": "precise-decimal",
      "rule": "adjacent decimals remain distinct",
      "mode": "subsume",
      "direction": "input",
      "leftJSON": "{\"openbindings\":\"0.2.0\",\"operations\":{\"test\":{\"input\":{\"const\":0.10000000000000000001}}}}",
      "rightJSON": "{\"openbindings\":\"0.2.0\",\"operations\":{\"test\":{\"input\":{\"const\":0.10000000000000000002}}}}",
      "expected": {
        "verdict": "incompatible"
      },
      "witness": {
        "instanceJSON": "0.10000000000000000001",
        "targetValid": true,
        "candidateValid": false
      },
      "numberTokens": {
        "left": [
          "0.10000000000000000001"
        ],
        "right": [
          "0.10000000000000000002"
        ],
        "witness": [
          "0.10000000000000000001"
        ]
      }
    },
    {
      "id": "overflow-const",
      "rule": "out-of-binary64-domain is not equality",
      "mode": "subsume",
      "direction": "input",
      "leftJSON": "{\"openbindings\":\"0.2.0\",\"operations\":{\"test\":{\"input\":{\"const\":1e400}}}}",
      "rightJSON": "{\"openbindings\":\"0.2.0\",\"operations\":{\"test\":{\"input\":{\"const\":2e400}}}}",
      "expected": {
        "verdict": "incompatible"
      },
      "witness": {
        "instanceJSON": "1e400",
        "targetValid": true,
        "candidateValid": false
      },
      "numberTokens": {
        "left": [
          "1e400"
        ],
        "right": [
          "2e400"
        ],
        "witness": [
          "1e400"
        ]
      }
    },
    {
      "id": "underflow-const",
      "rule": "underflow is not zero",
      "mode": "subsume",
      "direction": "input",
      "leftJSON": "{\"openbindings\":\"0.2.0\",\"operations\":{\"test\":{\"input\":{\"const\":0}}}}",
      "rightJSON": "{\"openbindings\":\"0.2.0\",\"operations\":{\"test\":{\"input\":{\"const\":1e-400}}}}",
      "expected": {
        "verdict": "incompatible"
      },
      "witness": {
        "instanceJSON": "0",
        "targetValid": true,
        "candidateValid": false
      },
      "numberTokens": {
        "left": [
          "0"
        ],
        "right": [
          "1e-400"
        ],
        "witness": [
          "0"
        ]
      }
    },
    {
      "id": "negative-minimum",
      "rule": "exact negative ordering",
      "mode": "subsume",
      "direction": "input",
      "leftJSON": "{\"openbindings\":\"0.2.0\",\"operations\":{\"test\":{\"input\":{\"type\":\"number\",\"minimum\":-9007199254740993}}}}",
      "rightJSON": "{\"openbindings\":\"0.2.0\",\"operations\":{\"test\":{\"input\":{\"type\":\"number\",\"minimum\":-9007199254740992}}}}",
      "expected": {
        "verdict": "incompatible"
      },
      "witness": {
        "instanceJSON": "-9007199254740993",
        "targetValid": true,
        "candidateValid": false
      },
      "numberTokens": {
        "left": [
          "-9007199254740993"
        ],
        "right": [
          "-9007199254740992"
        ],
        "witness": [
          "-9007199254740993"
        ]
      }
    },
    {
      "id": "wide-minimum-input",
      "rule": "input candidate must not narrow lower bound",
      "mode": "subsume",
      "direction": "input",
      "leftJSON": "{\"openbindings\":\"0.2.0\",\"operations\":{\"test\":{\"input\":{\"type\":\"number\",\"minimum\":9007199254740992}}}}",
      "rightJSON": "{\"openbindings\":\"0.2.0\",\"operations\":{\"test\":{\"input\":{\"type\":\"number\",\"minimum\":9007199254740993}}}}",
      "expected": {
        "verdict": "incompatible"
      },
      "witness": {
        "instanceJSON": "9007199254740992",
        "targetValid": true,
        "candidateValid": false
      },
      "numberTokens": {
        "left": [
          "9007199254740992"
        ],
        "right": [
          "9007199254740993"
        ],
        "witness": [
          "9007199254740992"
        ]
      }
    },
    {
      "id": "wide-maximum-input",
      "rule": "input candidate must not narrow upper bound",
      "mode": "subsume",
      "direction": "input",
      "leftJSON": "{\"openbindings\":\"0.2.0\",\"operations\":{\"test\":{\"input\":{\"type\":\"number\",\"maximum\":9007199254740993}}}}",
      "rightJSON": "{\"openbindings\":\"0.2.0\",\"operations\":{\"test\":{\"input\":{\"type\":\"number\",\"maximum\":9007199254740992}}}}",
      "expected": {
        "verdict": "incompatible"
      },
      "witness": {
        "instanceJSON": "9007199254740993",